{
	"name": "Cupcake",
	"description": "Frosting pink with a drifting sparkle backdrop and the oneko cat asleep on the message box. Light and dark.",
	"author": "fluxer-theme-library, oneko snippet by AZ, template by deeruwu",
	"license": "MIT",
	"tags": [
		"pink",
		"cute",
		"sparkles",
		"cat",
		"light",
		"dark"
	],
	"variants": [
		{
			"name": "Frosting",
			"file": "frosting.css",
			"base": "light",
			"description": "Strawberry frosting, bright and sweet.",
			"fluxerThemeId": "5ef16e0992b255e5",
			"fluxerThemeHash": "2ac78ecab8e31edf7d1d66e268d1042647e387bbee2ad9c642ebabe79c94b895"
		},
		{
			"name": "Velvet",
			"file": "velvet.css",
			"base": "dark",
			"description": "Red velvet after dark, easier on the eyes at 2am.",
			"fluxerThemeId": "71f64c4a4d0abdf4",
			"fluxerThemeHash": "d139abf8c7eb24c4b8e0fc2c3e2c9bf47ec01dde5ebb3e8283cc14935d17c3fd"
		}
	]
}
