{
	"name": "Fallout 4 Terminal",
	"description": "A RobCo terminal. One phosphor green on one near black, monospace throughout, green rules instead of panels.",
	"author": "Bates, ported by fluxer-theme-library",
	"homepage": "https://github.com/B4T3S/Fallout4TerminalTheme",
	"tags": [
		"dark",
		"green",
		"terminal",
		"monospace",
		"crt",
		"fallout",
		"port"
	],
	"variants": [
		{
			"name": "Terminal",
			"file": "terminal.css",
			"base": "dark",
			"description": "With the CRT scanlines, the way the original ships.",
			"fluxerThemeId": "c03b756b521e1aa3",
			"fluxerThemeHash": "7f02e3cde6c25678c61ec59142e1405315fc859fb543f6ae094a568664b9a352"
		},
		{
			"name": "No CRT",
			"file": "no-crt.css",
			"base": "dark",
			"description": "The same terminal with the scanline overlay removed.",
			"fluxerThemeId": "d05711e794afdd9d",
			"fluxerThemeHash": "e28bc48fbd6f65c31d1de1c9dd8b7f0233c43d091a1b8e9f72cdae8caf06f2b0"
		}
	]
}
